{"id":"ur-b1-u09-p06","language":"ur","cefr":"B1","unit":9,"sequence":54,"revision":1,"title":"عوامی انتخاب کا مشترک جائزہ","passage_type":"checkpoint","genre":"viewpoint","domains":["public","educational"],"topics":["public life and community choices"],"text":"ایک شہری مطالعہ گروہ نے پانچ مقامی مثالوں کو ایک ساتھ دیکھا۔ پہلی میں میئر نے مرکزی چوک کے بارے میں اجلاس بلایا، محلہ سے رائے لی گئی اور ہجوم کی موجودگی کو پوری آبادی کی رائے نہیں سمجھا گیا۔ دوسری مثال میں بازار کے ضابطہ، اندراج اور محدود رعایت کو ایک معلوم طریقے سے جوڑا گیا تاکہ تبدیلی قابلِ پیروی رہے۔\n\nتیسری مثال میں کئی فریق ایک پارک سے متاثر تھے۔ گروہ نے عدل کو صرف برابر نتیجہ نہیں بلکہ اثر، وجہ اور قابلِ رسائی شرکت کے ساتھ دیکھا۔ شہریت کو بھی حق کے ساتھ ذمہ دار عوامی شرکت سے جوڑا گیا۔ چوتھی مثال میں چھوٹے دکانداروں کی کمائی، ممکنہ استحصال اور رشوت کے درمیان فرق کیا گیا اور الزام کے بجائے رسید، معلوم فیس اور محفوظ شکایت پر زور دیا گیا۔\n\nپانچویں مثال میں بس راستے کے لیے نعرہ تھا، مگر آبادی کی افزائش اور ہمسایہ علاقے کی موجودہ سہولت دیکھے بغیر نیا راستہ طے نہیں کیا گیا۔ گروہ نے سیکھا کہ مہم کی زبان ضرورت دکھا سکتی ہے، جبکہ عملی فیصلہ مزید معلومات مانگتا ہے۔\n\nان تمام مثالوں میں عوامی انتخاب کا مشترک اصول یہی تھا کہ میئر، محلہ، ہجوم، ضابطہ، اندراج، رعایت، فریق، عدل، شہریت، کمائی، استحصال، رشوت، نعرہ، افزائش اور ہمسایہ جیسے الفاظ صرف موضوع نہیں بلکہ فیصلہ سازی کے مختلف حصے دکھاتے ہیں۔ اچھا عمل اثرات، قواعد، ثبوت اور شرکت کو ایک ہی جگہ دیکھتا ہے۔","word_count":232,"sentence_count":11,"estimated_known_token_coverage":0,"new_lexical_targets":[],"review_lexical_targets":[{"id":"ur-rank-1980","form":"میئر","review_stage":"R1","representation":"running_text"},{"id":"ur-rank-1678","form":"محلہ","review_stage":"R1","representation":"running_text"},{"id":"ur-rank-1714","form":"ہجوم","review_stage":"R1","representation":"running_text"},{"id":"ur-rank-1706","form":"ضابطہ","review_stage":"R1","representation":"running_text"},{"id":"ur-rank-1735","form":"اندراج","review_stage":"R1","representation":"running_text"},{"id":"ur-rank-1782","form":"رعایت","review_stage":"R1","representation":"running_text"},{"id":"ur-rank-1728","form":"فریق","review_stage":"R1","representation":"running_text"},{"id":"ur-rank-1662","form":"عدل","review_stage":"R1","representation":"running_text"},{"id":"ur-rank-1985","form":"شہریت","review_stage":"R1","representation":"running_text"},{"id":"ur-rank-1988","form":"کمائی","review_stage":"R1","representation":"running_text"},{"id":"ur-rank-1679","form":"استحصال","review_stage":"R1","representation":"running_text"},{"id":"ur-rank-1669","form":"رشوت","review_stage":"R1","representation":"running_text"},{"id":"ur-rank-1712","form":"نعرہ","review_stage":"R1","representation":"running_text"},{"id":"ur-rank-1729","form":"افزائش","review_stage":"R1","representation":"running_text"},{"id":"ur-rank-1791","form":"ہمسایہ","review_stage":"R1","representation":"running_text"}],"grammar_targets":[{"id":"ur-b1-u09-public-06","role":"integration","description":"integrate representation limits, procedural rules, justice criteria, transparency, and campaign-to-proposal reasoning"}],"discourse_targets":[{"id":"ur-b1-u09-discourse-06","role":"integration","description":"synthesize civic participation, regulation, stakeholder fairness, anti-corruption transparency, and infrastructure trade-offs"}],"questions":[{"id":"q1","type":"main_claim","prompt":"پانچوں مثالوں سے عوامی فیصلہ سازی کا کون سا مشترک اصول نکلتا ہے؟","answer_id":"a1"},{"id":"q2","type":"synthesis","prompt":"میئر، محلہ اور ہجوم نمائندگی کی حد کو کیسے واضح کرتے ہیں؟","answer_id":"a2","target_ids":["ur-rank-1980","ur-rank-1678","ur-rank-1714"]},{"id":"q3","type":"synthesis","prompt":"ضابطہ، اندراج اور رعایت منصفانہ طریقہ بنانے میں کیسے جڑتے ہیں؟","answer_id":"a3","target_ids":["ur-rank-1706","ur-rank-1735","ur-rank-1782"]},{"id":"q4","type":"synthesis","prompt":"فریق، عدل اور شہریت عوامی شرکت کے کس حصے کو واضح کرتے ہیں؟","answer_id":"a4","target_ids":["ur-rank-1728","ur-rank-1662","ur-rank-1985"]},{"id":"q5","type":"cause_effect","prompt":"کمائی، استحصال اور رشوت میں فرق جاننا شفافیت کے لیے کیوں ضروری ہے؟","answer_id":"a5","target_ids":["ur-rank-1988","ur-rank-1679","ur-rank-1669"]},{"id":"q6","type":"argument_relation","prompt":"نعرہ، افزائش اور ہمسایہ علاقے کی مثال مہم کو عملی تجویز میں کیسے بدلتی ہے؟","answer_id":"a6","target_ids":["ur-rank-1712","ur-rank-1729","ur-rank-1791"]},{"id":"q7","type":"inference","prompt":"گروہ ہر مثال میں صرف حاضر یا بلند آواز لوگوں پر انحصار کیوں نہیں کرتا؟","answer_id":"a7"},{"id":"q8","type":"vocabulary_in_context","prompt":"«عدل» کو جائزہ صرف برابر نتیجے کے بجائے کن چیزوں سے جوڑتا ہے؟","answer_id":"a8","target_ids":["ur-rank-1662"]},{"id":"q9","type":"cloze_transfer","prompt":"مہم کا مختصر یاد رہنے والا جملہ _____ کہلاتا ہے۔","answer_id":"a9","target_ids":["ur-rank-1712"]},{"id":"q10","type":"summary","prompt":"اچھے عوامی فیصلے کے چھ مختصر اصول بیان کریں۔","answer_id":"a10"}],"answer_key":[{"id":"a1","question_id":"q1","answer":"اثر، قواعد، ثبوت، شفافیت اور قابلِ رسائی شرکت کو ساتھ دیکھ کر فیصلہ کرنا۔","explanation":""},{"id":"a2","question_id":"q2","answer":"مقامی قیادت، ایک علاقے کی رائے اور حاضر لوگوں کی بڑی تعداد اہم ہیں مگر اکیلے پوری آبادی کی نمائندگی نہیں کرتے۔","explanation":""},{"id":"a3","question_id":"q3","answer":"قاعدہ توقع واضح کرتا ہے، ریکارڈ عمل کو قابلِ جانچ بناتا ہے، اور محدود آسانی معلوم معیار کے تحت تبدیلی ممکن بناتی ہے۔","explanation":""},{"id":"a4","question_id":"q4","answer":"متاثر گروہ پہچاننا، منصفانہ معیار بنانا اور ذمہ دار و قابلِ رسائی شہری شرکت فراہم کرنا۔","explanation":""},{"id":"a5","question_id":"q5","answer":"کیونکہ جائز آمدنی اور فیس کو ناجائز فائدہ یا فیصلے پر خفیہ اثر سے الگ پہچاننا ضروری ہے۔","explanation":""},{"id":"a6","question_id":"q6","answer":"مہم کی مختصر زبان کے ساتھ آبادی کی تبدیلی اور قریب موجود سہولت کا عملی ثبوت شامل ہوتا ہے۔","explanation":""},{"id":"a7","question_id":"q7","answer":"کیونکہ غیر حاضر، کم آواز یا مختلف رسائی رکھنے والے لوگ بھی فیصلے سے متاثر ہو سکتے ہیں۔","explanation":""},{"id":"a8","question_id":"q8","answer":"اثر، وجہ، ضرورت اور شرکت کے منصفانہ موقع سے۔","explanation":""},{"id":"a9","question_id":"q9","answer":"نعرہ","explanation":""},{"id":"a10","question_id":"q10","answer":"متاثر لوگ پہچانیں، معیار واضح کریں، ریکارڈ رکھیں، شفاف فیس و شکایت دیں، مہم کو ثبوت سے جانچیں، اور شرکت قابلِ رسائی بنائیں۔","explanation":""}],"speed_training":{"timed":true,"benchmark_eligible":false,"comprehension_gate":0.8,"new_word_policy":"none","notes":"Urdu B1 Unit 9 generation-stage checkpoint; formal release review remains separate."},"quality":{"status":"draft","linguistic_review":"pending","pedagogical_review":"pending","coverage_check":"pending","answer_key_check":"pending","schema_check":"pending","fact_check":"not_required","notes":["Generation-stage Urdu B1 Unit 9 checkpoint; formal release audits remain separate.","Checkpoint visibly recycles all fifteen Unit 9 lexical targets and remains politically neutral.","Reader-first pass applied for representation, procedural fairness, transparency, participation, and public trade-offs."]},"paired_text_group":null,"prerequisites":["Urdu B1 Unit 9 passages 1-5"],"reader_tags":["unit_role:fluency_checkpoint","generation_batch","urdu_b1_u09","calibration"],"difficulty_notes_internal":"B1 Unit 9: public life and community choices with representation, procedural fairness, transparency, and public trade-offs."}
