{"id":"ur-b1-u02-p06","language":"ur","cefr":"B1","unit":2,"sequence":12,"revision":1,"title":"کام کے فیصلوں کا بی ون جائزہ","passage_type":"checkpoint","genre":"checkpoint","domains":["professional"],"topics":["work and workplace choices","B1 checkpoint","workplace judgment"],"text":"ایک تربیتی نشست میں نئے ملازمین سے کہا گیا کہ وہ پانچ فرضی کام کی صورتوں کا جائزہ لیں اور ہر صورت میں اگلا مناسب قدم منتخب کریں۔ مقصد کسی ایک ادارے کا ضابطہ یاد کرنا نہیں تھا۔ مشق یہ دیکھتی تھی کہ ملازم معلومات، تعلقات اور وقت کی حد کو ساتھ رکھ کر وجہ کے ساتھ فیصلہ کر سکتا ہے یا نہیں۔\n\nپہلی صورت میں ایک شخص نئی ملازمت کے آغاز پر اپنا پیشہ اور ذمہ داریاں سمجھ رہا تھا۔ اسے جہاں مناسب ہو پہل کرنی تھی، مگر دوسروں کے کام کو نظر انداز نہیں کرنا تھا۔ دوسری صورت میں دو ساتھیوں کے درمیان تنازع تھا۔ بہتر جواب وہ تھا جس میں باہمی مسئلہ واضح کیا جائے اور احترام کے ساتھ دونوں ترجیحات سنی جائیں، نہ کہ اختلاف کو ذاتی دشمنی سمجھ لیا جائے۔\n\nتیسری صورت ایک دفتری پیغام تھی۔ لکھنے والے کو مختصر انداز میں مشورہ مانگنا تھا اور یہ بھی پوچھنا تھا کہ متعلقہ شخص کب دستیاب ہے۔ چوتھی صورت میں دو پیشکشوں کا موازنہ تھا۔ ایک کی تنخواہ زیادہ مگر کام عارضی تھا، جبکہ دوسری کا معاہدہ مختلف مدت کے لیے تھا۔ درست تجزیہ کسی ایک شرط کو ہمیشہ بہتر نہیں کہتا؛ فیصلہ موجودہ ترجیحات اور پوری معلومات کے مطابق کیا جاتا ہے۔\n\nآخری صورت میں ایک ٹیم مشترک کام کی تکمیل کی طرف بڑھ رہی تھی۔ منظم ریکارڈ سے ہر ملازم دیکھ سکتا تھا کہ اس کی ذمہ داری کہاں شروع اور ختم ہوتی ہے، لیکن ریکارڈ کو لوگوں کی قدر ناپنے کا واحد پیمانہ نہیں بنایا گیا۔ نشست کے اختتام پر تربیت دینے والے نے کہا کہ کام کی اچھی سمجھ صرف الفاظ پہچاننے سے نہیں بنتی۔ اہم بات یہ ہے کہ ملازمت، تنازع، مشورہ، معاہدہ اور تکمیل جیسے خیالات کو حالات کے اندر پڑھا جائے، ان کی حدود پہچانی جائیں اور فیصلے کی وجہ واضح کی جائے۔","word_count":304,"sentence_count":16,"estimated_known_token_coverage":0,"new_lexical_targets":[],"review_lexical_targets":[{"id":"ur-rank-1205","form":"ملازمت","review_stage":"R2","representation":"running_text"},{"id":"ur-rank-1341","form":"پیشہ","review_stage":"R2","representation":"running_text"},{"id":"ur-rank-1143","form":"پہل","review_stage":"R2","representation":"running_text"},{"id":"ur-rank-1114","form":"باہمی","review_stage":"R2","representation":"running_text"},{"id":"ur-rank-1115","form":"تنازع","review_stage":"R2","representation":"running_text"},{"id":"ur-rank-1123","form":"احترام","review_stage":"R2","representation":"running_text"},{"id":"ur-rank-1119","form":"مشورہ","review_stage":"R2","representation":"running_text"},{"id":"ur-rank-1133","form":"مختصر","review_stage":"R2","representation":"running_text"},{"id":"ur-rank-1173","form":"دستیاب","review_stage":"R2","representation":"running_text"},{"id":"ur-rank-1343","form":"تنخواہ","review_stage":"R2","representation":"running_text"},{"id":"ur-rank-1351","form":"عارضی","review_stage":"R2","representation":"running_text"},{"id":"ur-rank-1178","form":"معاہدہ","review_stage":"R2","representation":"running_text"},{"id":"ur-rank-1358","form":"ملازم","review_stage":"R2","representation":"running_text"},{"id":"ur-rank-1326","form":"منظم","review_stage":"R2","representation":"running_text"},{"id":"ur-rank-1137","form":"تکمیل","review_stage":"R2","representation":"running_text"}],"grammar_targets":[{"id":"ur-b1-u02-checkpoint-qualification","role":"integration","description":"integrate comparison, qualification, requests, and conditional reasoning across workplace choices"}],"discourse_targets":[{"id":"ur-b1-u02-workplace-checkpoint","role":"integration","description":"synthesize initiative, conflict, professional requests, job conditions, and coordinated completion"}],"questions":[{"id":"q1","type":"main_claim","prompt":"تربیتی نشست کام کے فیصلوں کے بارے میں کون سی عمومی صلاحیت جانچتی ہے؟","answer_id":"a1"},{"id":"q2","type":"cause_effect","prompt":"پہل کو دوسروں کی ذمہ داری کے ساتھ کیوں جوڑا گیا ہے؟","answer_id":"a2","target_ids":["ur-rank-1143"]},{"id":"q3","type":"inference","prompt":"باہمی احترام تنازع کو ختم کیے بغیر بھی اسے مفید کیسے بنا سکتا ہے؟","answer_id":"a3","target_ids":["ur-rank-1114","ur-rank-1115","ur-rank-1123"]},{"id":"q4","type":"register_style","prompt":"دفتری پیغام میں مختصر انداز اور دستیابی پوچھنے کو ایک ساتھ کیوں رکھا گیا ہے؟","answer_id":"a4","target_ids":["ur-rank-1133","ur-rank-1173"]},{"id":"q5","type":"argument_relation","prompt":"تنخواہ، عارضی مدت اور معاہدے کو ایک ہی مثال میں رکھنے کا مقصد کیا ہے؟","answer_id":"a5","target_ids":["ur-rank-1343","ur-rank-1351","ur-rank-1178"]},{"id":"q6","type":"motive","prompt":"منظم ریکارڈ کو ملازمین کی قدر ناپنے کا واحد پیمانہ کیوں نہیں بنایا گیا؟","answer_id":"a6","target_ids":["ur-rank-1326","ur-rank-1358"]},{"id":"q7","type":"reference_resolution","prompt":"آخری پیراگراف میں «ان کی حدود» کن خیالات کی طرف اشارہ کرتا ہے؟","answer_id":"a7"},{"id":"q8","type":"grammar_in_context","prompt":"«مگر» اور «جبکہ» جیسے الفاظ اس جائزے میں کس کام آتے ہیں؟","answer_id":"a8"},{"id":"q9","type":"cloze_transfer","prompt":"کام مکمل ہونے کے مرحلے یا عمل کو _____ کہا جا سکتا ہے۔","answer_id":"a9","target_ids":["ur-rank-1137"]},{"id":"q10","type":"summary","prompt":"پورے یونٹ سے کام کے فیصلوں کے چار اصول جمع کریں۔","answer_id":"a10"}],"answer_key":[{"id":"a1","question_id":"q1","answer":"معلومات، تعلقات اور وقت کی حد کو ساتھ دیکھ کر مناسب قدم منتخب کرنا اور اس کی وجہ واضح کرنا۔","explanation":""},{"id":"a2","question_id":"q2","answer":"تاکہ خود سے قدم اٹھانا مداخلت نہ بنے اور مشترک کام کی حدود برقرار رہیں۔","explanation":""},{"id":"a3","question_id":"q3","answer":"وہ دونوں ترجیحات کو سننے اور اختلاف کو کام کے مسئلے تک محدود رکھنے دیتا ہے، جس سے مشترک حل بن سکتا ہے۔","explanation":""},{"id":"a4","question_id":"q4","answer":"اس سے درخواست واضح رہتی ہے اور دوسرے شخص کے وقت و شیڈول کا خیال بھی رکھا جاتا ہے۔","explanation":""},{"id":"a5","question_id":"q5","answer":"یہ دکھانا کہ کام کی پیشکش کا فیصلہ کئی شرائط کے باہمی موازنے سے ہوتا ہے، کسی ایک شرط سے نہیں۔","explanation":""},{"id":"a6","question_id":"q6","answer":"کیونکہ ریکارڈ کام کی حالت دکھاتا ہے، مگر مشکل، سیاق اور ذمہ داری کی نوعیت بھی سمجھنا ضروری ہے۔","explanation":""},{"id":"a7","question_id":"q7","answer":"ملازمت، تنازع، مشورہ، معاہدہ اور تکمیل جیسے کام کے تصورات اور ان کے مناسب استعمال کی حدود کی طرف۔","explanation":""},{"id":"a8","question_id":"q8","answer":"وہ دو شرائط یا ترجیحات کے فرق کو واضح کرتے ہیں اور ایک طرفہ نتیجہ نکالنے سے روکتے ہیں۔","explanation":""},{"id":"a9","question_id":"q9","answer":"تکمیل","explanation":""},{"id":"a10","question_id":"q10","answer":"مناسب جگہ پہل کریں، تنازع میں باہمی احترام رکھیں، مشورہ واضح اور مختصر انداز میں مانگیں، اور تنخواہ، مدت، معاہدے اور منظم کام کی معلومات کو مکمل سیاق میں دیکھ کر فیصلہ کریں۔","explanation":""}],"speed_training":{"timed":true,"benchmark_eligible":false,"comprehension_gate":0.8,"new_word_policy":"none","notes":"Urdu B1 Unit 2 generation-stage passage; formal release review remains separate."},"quality":{"status":"draft","linguistic_review":"pending","pedagogical_review":"pending","coverage_check":"pending","answer_key_check":"pending","schema_check":"pending","fact_check":"not_required","notes":["Generation-stage Urdu B1 Unit 2 draft; formal release audits remain separate.","Workplace situations are constructed and do not assert jurisdiction-specific employment rules.","Reader-first pass applied for B1-level workplace judgment, qualification, and inference."]},"paired_text_group":null,"prerequisites":["Urdu B1 Unit 2 passages 1-5"],"reader_tags":["unit_role:fluency_checkpoint","generation_batch","urdu_b1_u02","calibration"],"difficulty_notes_internal":"B1 Unit 2: connected workplace reasoning, trade-offs, motive/inference, vocabulary in context, and concise synthesis."}
