{"answer_key":[{"answer":"عائشہ کھانے، خریداری اور گھر کے چھوٹے کام منظم کرتی ہے۔","explanation":"یہ پورے متن کا مرکزی خیال ہے۔","id":"a1","question_id":"q1"},{"answer":"کیونکہ اسے ہلکا مشروب چاہیے ہوتا ہے۔","explanation":"متن میں پانی چننے کی وجہ یہی ہے۔","id":"a2","question_id":"q2"},{"answer":"وہ خالہ کے ساتھ فہرست بناتی ہے اور ضرورت کی چند چیزیں خریدتی ہے۔","explanation":"گھر میں چیز کم ہونے پر یہی عمل بیان ہوا ہے۔","id":"a3","question_id":"q3"},{"answer":"وہ دیکھتی ہے کہ یہاں کیا موجود ہے۔","explanation":"مختلف دکانوں کی صورت میں پہلے بازار کی موجود چیزیں دیکھی جاتی ہیں۔","id":"a4","question_id":"q4"},{"answer":"وہ پوچھتی ہے کہ کیا ابھی کچھ تیار ہے یا انتظار کرنا ہے۔","explanation":"کھانا بنانے کے وقت یہی سوال متن میں ہے۔","id":"a5","question_id":"q5"},{"answer":"اپنے ہی کام یا اپنی ذمہ داری سے متعلق۔","explanation":"«اپنا» خود سے متعلق چیز یا کام دکھاتا ہے۔","id":"a6","question_id":"q6"},{"answer":"ضروری یا خاص توجہ کے قابل۔","explanation":"«اہم» وقت اور صفائی کی قدر بتاتا ہے۔","id":"a7","question_id":"q7"},{"answer":"ضرورت؛ چند","explanation":"پہلا لفظ حاجت اور دوسرا تھوڑی تعداد بتاتا ہے۔","id":"a8","question_id":"q8"},{"answer":"مختلف؛ یہاں","explanation":"الگ الگ دکانوں اور موجود مقام کے لیے یہ الفاظ درست ہیں۔","id":"a9","question_id":"q9"},{"answer":"ابھی؛ تیار","explanation":"موجودہ وقت اور مکمل حالت کے لیے یہ دونوں الفاظ درست ہیں۔","id":"a10","question_id":"q10"}],"cefr":"A1","discourse_targets":[{"id":"a1-unit03-cumulative-checkpoint","role":"integration","description":"cumulative restatement of food, shopping, choice, and simple routine language"}],"domains":["personal","public"],"estimated_known_token_coverage":0,"genre":"checkpoint","grammar_targets":[{"id":"ur-a1-basic-reason-place-time-review","role":"integration","description":"integrated review of simple reason, place, time, and possessive expressions"}],"id":"ur-a1-u03-p06","language":"ur","new_lexical_targets":[],"passage_type":"fluency","quality":{"answer_key_check":"pending","coverage_check":"pending","fact_check":"not_required","linguistic_review":"pending","notes":["Generated as Urdu A1 Unit 03 checkpoint under generation-first policy.","No new lexical targets are introduced in the sixth passage.","Formal final audit is deferred; canonical promotion remains gated on earlier Urdu calibration/Unit 02 promotion."],"pedagogical_review":"pending","schema_check":"pending","status":"draft"},"questions":[{"answer_id":"a1","id":"q1","prompt":"اس عبارت کا مرکزی خیال کیا ہے؟","type":"gist"},{"answer_id":"a2","id":"q2","prompt":"عائشہ کبھی پانی کیوں چنتی ہے؟","type":"cause_effect","target_ids":["ur-rank-0124","ur-rank-0115"]},{"answer_id":"a3","id":"q3","prompt":"گھر میں کوئی چیز کم ہو تو عائشہ کیا کرتی ہے؟","type":"literal_detail","target_ids":["ur-rank-0110","ur-rank-0231"]},{"answer_id":"a4","id":"q4","prompt":"بازار میں مختلف دکانیں ہوں تو عائشہ پہلے کیا دیکھتی ہے؟","type":"literal_detail","target_ids":["ur-rank-0114","ur-rank-0159"]},{"answer_id":"a5","id":"q5","prompt":"کھانا بناتے وقت عائشہ کیا پوچھتی ہے؟","type":"literal_detail","target_ids":["ur-rank-0233","ur-rank-0247"]},{"answer_id":"a6","id":"q6","prompt":"«اپنا کام» میں «اپنا» کیا تعلق دکھاتا ہے؟","type":"vocabulary_in_context","target_ids":["ur-rank-0167"]},{"answer_id":"a7","id":"q7","prompt":"«وقت اور صفائی دونوں اہم ہیں» میں «اہم» کا کیا مطلب ہے؟","type":"vocabulary_in_context","target_ids":["ur-rank-0161"]},{"answer_id":"a8","id":"q8","prompt":"خالی جگہیں پُر کریں: مجھے روٹی کی _____ ہے، اس لیے میں _____ روٹیاں لیتا ہوں۔","type":"cloze_transfer","target_ids":["ur-rank-0110","ur-rank-0231"]},{"answer_id":"a9","id":"q9","prompt":"خالی جگہیں پُر کریں: بازار میں _____ دکانیں ہیں؛ میں دیکھتا ہوں کہ _____ کیا ملتا ہے۔","type":"cloze_transfer","target_ids":["ur-rank-0114","ur-rank-0159"]},{"answer_id":"a10","id":"q10","prompt":"خالی جگہیں پُر کریں: کھانا _____ بن رہا ہے؛ مکمل ہو تو وہ _____ ہوگا۔","type":"cloze_transfer","target_ids":["ur-rank-0247","ur-rank-0233"]}],"review_lexical_targets":[{"expected_exposure_number":null,"form":"پانی","id":"ur-rank-0124","representation":"running_text","review_stage":"R3"},{"expected_exposure_number":null,"form":"کیونکہ","id":"ur-rank-0115","representation":"running_text","review_stage":"R3"},{"expected_exposure_number":null,"form":"ضرورت","id":"ur-rank-0110","representation":"running_text","review_stage":"R3"},{"expected_exposure_number":null,"form":"چند","id":"ur-rank-0231","representation":"running_text","review_stage":"R3"},{"expected_exposure_number":null,"form":"مختلف","id":"ur-rank-0114","representation":"running_text","review_stage":"R2"},{"expected_exposure_number":null,"form":"یہاں","id":"ur-rank-0159","representation":"running_text","review_stage":"R2"},{"expected_exposure_number":null,"form":"تیار","id":"ur-rank-0233","representation":"running_text","review_stage":"R1"},{"expected_exposure_number":null,"form":"ابھی","id":"ur-rank-0247","representation":"running_text","review_stage":"R1"},{"expected_exposure_number":null,"form":"اپنا","id":"ur-rank-0167","representation":"running_text","review_stage":"R1"},{"expected_exposure_number":null,"form":"اہم","id":"ur-rank-0161","representation":"running_text","review_stage":"R1"}],"revision":1,"sentence_count":7,"sequence":18,"speed_training":{"benchmark_eligible":false,"comprehension_gate":0.8,"new_word_policy":"none","notes":"Generation-stage fluency checkpoint; benchmark decision deferred to final audit.","timed":true},"text":"عائشہ کے ہفتے میں کھانے اور خریداری کے کئی چھوٹے کام ہوتے ہیں۔ کبھی وہ ناشتہ کرتے وقت پانی چنتی ہے کیونکہ اسے ہلکا مشروب چاہیے ہوتا ہے۔ گھر میں چیز کم ہو تو وہ خالہ کے ساتھ فہرست بناتی ہے اور ضرورت کی چند چیزیں خریدتی ہے۔ بازار میں مختلف دکانیں ہوں تو وہ پہلے دیکھتی ہے کہ یہاں کیا موجود ہے۔ کھانا بنانے کے وقت وہ پوچھتی ہے کہ کیا ابھی کچھ تیار ہے یا اسے انتظار کرنا ہے۔ عائشہ اپنا کام خود کرنے کی کوشش بھی کرتی ہے، کیونکہ وقت اور صفائی دونوں اہم ہیں۔ اس طرح وہ کھانے، خریداری اور گھر کے کام کو آسان ترتیب میں رکھتی ہے اور دوسروں کی مدد بھی کرتی ہے۔","title":"کھانے اور خریداری کا دن","topics":["food","shopping","routine","review"],"unit":3,"word_count":120}
