{"id":"ur-b2-u07-p06","language":"ur","cefr":"B2","unit":7,"sequence":42,"revision":1,"title":"فن کی تعبیر: ردعمل سے دلیل تک","passage_type":"checkpoint","genre":"critical comparison","domains":["public","educational","professional"],"topics":["arts and interpretation"],"text":"اس یونٹ کی مثالوں نے فن کو پسند یا ناپسند کے فوری فیصلے سے آگے لے جانے کی کوشش کی۔ موسیقی کے جائزے میں ایک تان صرف خوب صورت آواز نہیں تھی؛ اس کا مقام، پھیلاؤ اور دوسرے سازوں سے تعلق معنی بناتا تھا۔ اسی طرح ہر ناظر اپنی جگہ، تجربے اور توجہ کے مطابق مختلف چیز محسوس کرسکتا تھا۔ اس فرق کا مطلب یہ نہیں کہ ہر تعبیر برابر مضبوط ہے، بلکہ یہ کہ مضبوط تعبیر کو کام کے قابلِ مشاہدہ شواہد سے جوڑنا چاہیے۔\n\nفلم کے پروفائل نے یہی اصول تصویر پر لاگو کیا۔ ہر شاٹ ناظر کی توجہ کو کسی خاص سمت میں لے جاتا ہے، اور کیمرا کا فاصلہ یہ طے کرسکتا ہے کہ کون سی معلومات فوراً ملتی ہیں اور کون سی دیر سے۔ مہنگا آلہ خودکار طور پر بہتر معنی نہیں بناتا؛ فنی فیصلہ اس وقت مؤثر ہوتا ہے جب شکل اور مقصد میں تعلق ہو۔\n\nعجائب گھر کی مثال نے نسبت کے مسئلے کو پیچیدہ کیا۔ گمنام کام لازماً کم قدر نہیں، کیونکہ خالق کا نام نہ ہونے کے باوجود خود تصویر تاریخی اور فنی ثبوت فراہم کرسکتی ہے۔ اس کے برعکس نقلی نسبت تاریخ کو غلط سمت میں لے جاسکتی ہے، خاص طور پر جب بعد کے کام کو پرانا اصل سمجھ لیا جائے۔ اس لیے نام، اصل اور انداز کو الگ الگ جانچنا ضروری ہے۔\n\nنمائش کے جائزے نے تعریف کی زبان پر سوال اٹھایا۔ پوسٹر توجہ پیدا کرسکتا ہے، مگر وہ پورے تجربے کا ثبوت نہیں۔ کسی کام کو لاجواب کہنا تب زیادہ معنی رکھتا ہے جب ناقد واضح کرے کہ وہ ساخت، مواد، خیال یا اثر میں کس خوبی کی بات کررہا ہے۔ بڑی صفت کو مخصوص مشاہدے کی ضرورت ہوتی ہے۔\n\nرقص کے پروفائل میں تال اور تجسس نے ایک اور تعلق دکھایا۔ تال مشترک ساخت دیتا ہے، جبکہ تجسس اس ساخت کے اندر تبدیلی آزمانے کی اجازت دیتا ہے۔ اگر آزادی سے ہر قاعدہ ختم ہوجائے تو موازنہ مشکل ہوسکتا ہے؛ اگر کوئی سوال نہ ہو تو فن محض نقل بن سکتا ہے۔ دونوں کے درمیان توازن نئی تشریح کے لیے جگہ بناتا ہے۔\n\nان سب مثالوں کو جوڑیں تو فنی تنقید کے پانچ اصول سامنے آتے ہیں۔ تان، شاٹ یا تال جیسے فنی فیصلے کو اس کے کام کے اندر دیکھیں۔ ناظر کے زاویے کو اہم سمجھیں مگر دلیل کو شواہد سے جوڑیں۔ گمنام اور نقلی جیسے مختلف مسائل کو ایک نہ سمجھیں۔ پوسٹر اور لاجواب جیسے تشہیری یا تعریفی اشاروں کو جانچیں۔ اور کیمرا یا تجسس جیسے ذرائع کو مقصد کے ساتھ پرکھیں۔ اچھی تشریح فن کو بند نہیں کرتی؛ وہ ممکنہ معنوں کے درمیان بہتر دلیل قائم کرتی ہے۔","word_count":435,"sentence_count":26,"estimated_known_token_coverage":0,"new_lexical_targets":[],"review_lexical_targets":[{"id":"ur-rank-2514","form":"تان","review_stage":"R1","representation":"running_text"},{"id":"ur-rank-2534","form":"ناظر","review_stage":"R1","representation":"running_text"},{"id":"ur-rank-2532","form":"شاٹ","review_stage":"R1","representation":"running_text"},{"id":"ur-rank-2583","form":"کیمرا","review_stage":"R1","representation":"running_text"},{"id":"ur-rank-2536","form":"گمنام","review_stage":"R1","representation":"running_text"},{"id":"ur-rank-2546","form":"نقلی","review_stage":"R1","representation":"running_text"},{"id":"ur-rank-2579","form":"پوسٹر","review_stage":"R1","representation":"running_text"},{"id":"ur-rank-2544","form":"لاجواب","review_stage":"R1","representation":"running_text"},{"id":"ur-rank-2586","form":"تال","review_stage":"R1","representation":"running_text"},{"id":"ur-rank-2587","form":"تجسس","review_stage":"R1","representation":"running_text"}],"grammar_targets":[{"id":"ur-b2-u07-grammar-06","role":"integration","description":"use contrast, qualification, evidence, and scope to compare artistic interpretations"}],"discourse_targets":[{"id":"ur-b2-u07-discourse-06","role":"integration","description":"connect artistic form, audience perspective, attribution, evidence, and evaluative claims"}],"questions":[{"id":"q1","type":"main_claim","prompt":"پورے یونٹ کا مشترک تنقیدی اصول کیا ہے؟","answer_id":"a1"},{"id":"q2","type":"synthesis","prompt":"تان اور ناظر کی مثال تشریح کے بارے میں کیا سکھاتی ہے؟","answer_id":"a2","target_ids":["ur-rank-2514","ur-rank-2534"]},{"id":"q3","type":"synthesis","prompt":"شاٹ اور کیمرا کے تعلق سے فلمی معنی کے بارے میں کیا نتیجہ نکلتا ہے؟","answer_id":"a3","target_ids":["ur-rank-2532","ur-rank-2583"]},{"id":"q4","type":"synthesis","prompt":"گمنام اور نقلی کے فرق سے فنی نسبت کے بارے میں کیا سبق ملتا ہے؟","answer_id":"a4","target_ids":["ur-rank-2536","ur-rank-2546"]},{"id":"q5","type":"synthesis","prompt":"پوسٹر اور لاجواب کی مثال تنقیدی زبان کی کون سی حد دکھاتی ہے؟","answer_id":"a5","target_ids":["ur-rank-2579","ur-rank-2544"]},{"id":"q6","type":"synthesis","prompt":"تال اور تجسس ایک ساتھ فنی تربیت میں کیا کردار ادا کرتے ہیں؟","answer_id":"a6","target_ids":["ur-rank-2586","ur-rank-2587"]},{"id":"q7","type":"cross_text_synthesis","prompt":"یونٹ میں ناظر کا کردار مختلف فنون میں کس طرح بدلتا ہے؟","answer_id":"a7"},{"id":"q8","type":"inference","prompt":"یونٹ ہر تعبیر کو برابر مضبوط کیوں نہیں سمجھتا؟","answer_id":"a8"},{"id":"q9","type":"stance","prompt":"یونٹ فنی آزادی اور تنقیدی معیار کے تعلق کو کیسے دیکھتا ہے؟","answer_id":"a9"},{"id":"q10","type":"summary","prompt":"یونٹ کے پانچ عملی تنقیدی اصول مختصراً بیان کریں۔","answer_id":"a10"}],"answer_key":[{"id":"a1","question_id":"q1","answer":"فنی تعبیر کو ذاتی ردعمل سے آگے بڑھا کر مخصوص فنی فیصلوں، ناظر کے زاویے اور قابلِ مشاہدہ شواہد سے جوڑنا چاہیے۔","explanation":""},{"id":"a2","question_id":"q2","answer":"فنی ساخت اور دیکھنے یا سننے والے کی جگہ دونوں تجربہ بدل سکتے ہیں، مگر دلیل کو خود پیشکش کے شواہد سے جڑنا چاہیے۔","explanation":""},{"id":"a3","question_id":"q3","answer":"فریم اور آلے کی جگہ یہ طے کرتی ہے کہ ناظر کیا دیکھتا اور کب جانتا ہے، اس لیے تکنیک کو مقصد کے ساتھ پڑھنا چاہیے۔","explanation":""},{"id":"a4","question_id":"q4","answer":"نامعلوم خالق اور غلط اصل ہونے کا دعویٰ الگ مسائل ہیں، اس لیے دونوں کو ایک ہی نتیجے سے نہیں جانچنا چاہیے۔","explanation":""},{"id":"a5","question_id":"q5","answer":"تشہیری اشارہ اور بڑی تعریف خود ثبوت نہیں؛ دونوں کو اصل کام اور مخصوص مشاہدے سے جانچنا پڑتا ہے۔","explanation":""},{"id":"a6","question_id":"q6","answer":"تال نظم اور مشترک ساخت دیتی ہے، جبکہ تجسس محدود تجربے سے نئی ممکنہ تعبیر کھولتا ہے۔","explanation":""},{"id":"a7","question_id":"q7","answer":"کبھی وہ آواز سنتا ہے، کبھی فلمی معلومات جوڑتا ہے، کبھی نسبت پر سوال کرتا ہے اور کبھی تشہیر و پیشکش کا موازنہ کرتا ہے۔","explanation":""},{"id":"a8","question_id":"q8","answer":"کیونکہ تعبیر کی قوت اس بات پر منحصر ہے کہ وہ کام کے قابلِ مشاہدہ فنی اور تاریخی شواہد کو کتنی اچھی طرح سمجھاتی ہے۔","explanation":""},{"id":"a9","question_id":"q9","answer":"وہ متعدد معنوں کی گنجائش مانتا ہے مگر دلیل، دائرے اور ثبوت کے معیار کو برقرار رکھتا ہے۔","explanation":""},{"id":"a10","question_id":"q10","answer":"فنی فیصلے کو سیاق میں دیکھیں، ناظر کے زاویے کو سمجھیں، نسبت کے مختلف مسائل الگ رکھیں، تشہیری و تعریفی دعووں کو جانچیں اور تجربے کو مقصد و شواہد سے جوڑیں۔","explanation":""}],"speed_training":{"timed":true,"benchmark_eligible":true,"comprehension_gate":0.8,"new_word_policy":"none","notes":"checkpoint fluency with no new vocabulary"},"quality":{"status":"draft","linguistic_review":"pending","pedagogical_review":"pending","coverage_check":"pending","answer_key_check":"pending","schema_check":"pending","fact_check":"not_required","notes":[]}}
