{"id":"ur-b2-u05-p06","language":"ur","cefr":"B2","unit":5,"sequence":30,"revision":1,"title":"موسمی غیر یقینی: شواہد سے فیصلے تک","passage_type":"checkpoint","genre":"argument","domains":["public","educational","professional"],"topics":["climate and uncertainty","evidence synthesis","decision making"],"text":"اس یونٹ کی مثالوں نے دکھایا کہ آب و ہوا کے بارے میں اچھی سوچ صرف یہ پوچھنے سے نہیں بنتی کہ کوئی دعویٰ درست ہے یا غلط۔ زیادہ مفید سوال یہ ہے کہ شواہد کس پیمانے کے ہیں، ان میں کتنی غیر یقینی ہے، اور فیصلہ کس قسم کے نقصان سے متعلق ہے۔ پہلی مثال میں ایک آندھی کو پورے طویل مدتی رجحان کا قطعی ثبوت سمجھنے سے گریز کیا گیا۔ اس کے مقابلے میں گرم راتوں کا متواتر ریکارڈ زیادہ مضبوط اشارہ بن سکتا تھا، کیونکہ وہ ایک واقعے کے بجائے وقت کے ساتھ تکرار دکھاتا تھا۔\n\nزرعی مثال نے پیمانے کا دوسرا فرق واضح کیا۔ ایک قطرہ، ایک بارش اور پورے موسم کی مجموعی مقدار ایک ہی چیز نہیں۔ اسی طرح ایک کھیت کی مٹی اور انتظام پورے ضلع کی نمائندگی نہیں کرتے۔ اگر اوسط بارش تقریباً برابر رہے لیکن پانی مختلف وقت پر یا مختلف شدت سے آئے تو فصل پر اثر بدل سکتا ہے۔ اس لیے مجموعی عدد کے ساتھ مقامی مشاہدہ بھی ضروری ہے۔\n\nگرمی کی خبر میں انسانی جسم اور شہری نظام ایک ساتھ سامنے آئے۔ زیادہ پسینہ پانی کی ضرورت بڑھنے کی علامت ہو سکتا ہے، مگر ہر مریض کی حالت ایک جیسی نہیں ہوتی۔ دوسری طرف پرانا پائپ شدید طلب کے وقت نظام کی کمزوری بڑھا سکتا ہے۔ صرف صارفین کو ذمہ دار ٹھہرانا یا صرف بنیادی ڈھانچے کو قصوروار کہنا دونوں جلد بازی ہو سکتے ہیں۔ مختلف ذرائع سے شواہد جمع کرنا زیادہ محفوظ راستہ ہے۔\n\nمرکب پیمائش کی مثال نے بتایا کہ انڈیکس مفید خلاصہ ہے مگر مکمل حقیقت نہیں۔ اگر صرف ایک چوتھائی علاقوں میں واضح تبدیلی ہو تو اسے پورے شہر کا یکساں نتیجہ کہنا دائرہ بڑھانا ہے۔ ساتھ ہی یہ بھی دیکھنا ہوگا کہ اس چوتھائی میں کتنے لوگ رہتے ہیں، خطرہ کتنا شدید ہے اور استعمال کیے گئے اعداد کتنے تازہ ہیں۔ عدد کی سہولت کو اس کی حدود بھلانے نہیں دینا چاہیے۔\n\nآخری دلیل نے فیصلہ سازی کا سوال اٹھایا۔ اگر کسی جاندار کے معدوم ہونے جیسے ناقابلِ واپسی نقصان کا امکان موجود ہو تو مکمل یقین کا انتظار خود خطرہ بن سکتا ہے۔ اس صورت میں مرحلہ وار عمل ایک سبیل فراہم کرتا ہے: کم لاگت قدم، واضح نگرانی، پہلے سے طے شدہ حدیں اور نئی معلومات کے مطابق نظر ثانی۔ یہ رویہ ہر خطرے کو یقینی نہیں سمجھتا بلکہ غلطی کی دونوں سمتوں کو دیکھتا ہے۔\n\nان سب مثالوں کو جوڑیں تو چار اصول سامنے آتے ہیں۔ ایک واقعے اور متواتر رجحان میں فرق کریں۔ قطرہ اور کھیت جیسے مقامی شواہد کو بڑے نقشے کے ساتھ رکھیں۔ پسینہ، پائپ، انڈیکس اور چوتھائی جیسے اشاروں کو ان کے دائرے سے باہر نہ پھیلائیں۔ اور جہاں معدوم ہونے جیسا بڑا ناقابلِ واپسی نقصان ممکن ہو وہاں عمل کی سبیل ایسی بنائیں جس میں سیکھنے اور تبدیلی کی گنجائش باقی رہے۔","word_count":466,"sentence_count":27,"estimated_known_token_coverage":0,"new_lexical_targets":[],"review_lexical_targets":[{"id":"ur-rank-2323","form":"متواتر","review_stage":"R1","representation":"running_text"},{"id":"ur-rank-2339","form":"آندھی","review_stage":"R1","representation":"running_text"},{"id":"ur-rank-2347","form":"قطرہ","review_stage":"R1","representation":"running_text"},{"id":"ur-rank-2286","form":"کھیت","review_stage":"R1","representation":"running_text"},{"id":"ur-rank-2357","form":"پسینہ","review_stage":"R1","representation":"running_text"},{"id":"ur-rank-2356","form":"پائپ","review_stage":"R1","representation":"running_text"},{"id":"ur-rank-2375","form":"انڈیکس","review_stage":"R1","representation":"running_text"},{"id":"ur-rank-2428","form":"چوتھائی","review_stage":"R1","representation":"running_text"},{"id":"ur-rank-2419","form":"معدوم","review_stage":"R1","representation":"running_text"},{"id":"ur-rank-2418","form":"سبیل","review_stage":"R1","representation":"running_text"}],"grammar_targets":[{"id":"ur-b2-u05-grammar-06","role":"integration","description":"use qualification, contrast, condition, and scope to reason under uncertainty"}],"discourse_targets":[{"id":"ur-b2-u05-discourse-06","role":"integration","description":"connect evidence strength, scale, uncertainty, counterclaims, and decision consequences"}],"questions":[{"id":"q1","type":"main_claim","prompt":"پورے یونٹ کا مشترک اصول کیا ہے؟","answer_id":"a1"},{"id":"q2","type":"synthesis","prompt":"آندھی اور متواتر ریکارڈ کا تقابل کیا سبق دیتا ہے؟","answer_id":"a2","target_ids":["ur-rank-2339","ur-rank-2323"]},{"id":"q3","type":"synthesis","prompt":"قطرہ اور کھیت کی مثال کس قسم کی حد دکھاتی ہے؟","answer_id":"a3","target_ids":["ur-rank-2347","ur-rank-2286"]},{"id":"q4","type":"synthesis","prompt":"پسینہ اور پائپ کو ایک ساتھ دیکھنے سے کیا فائدہ ہے؟","answer_id":"a4","target_ids":["ur-rank-2357","ur-rank-2356"]},{"id":"q5","type":"synthesis","prompt":"انڈیکس اور چوتھائی کی مثال عمومی دعوے کی کس غلطی کو واضح کرتی ہے؟","answer_id":"a5","target_ids":["ur-rank-2375","ur-rank-2428"]},{"id":"q6","type":"synthesis","prompt":"معدوم ہونے کے خطرے اور عمل کی سبیل میں کیا تعلق ہے؟","answer_id":"a6","target_ids":["ur-rank-2419","ur-rank-2418"]},{"id":"q7","type":"cross_text_synthesis","prompt":"پانچوں مثالوں میں «پیمانہ» کس کس شکل میں بدلا؟","answer_id":"a7"},{"id":"q8","type":"inference","prompt":"غیر یقینی کو واضح کرنا عمل کو بہتر کیسے بنا سکتا ہے؟","answer_id":"a8"},{"id":"q9","type":"stance","prompt":"یونٹ قطعی یقین اور مکمل جمود دونوں سے کیوں بچتا ہے؟","answer_id":"a9"},{"id":"q10","type":"summary","prompt":"یونٹ کے چار عملی اصول مختصراً بیان کریں۔","answer_id":"a10"}],"answer_key":[{"id":"a1","question_id":"q1","answer":"موسمی شواہد کو درست پیمانے اور غیر یقینی کے ساتھ پڑھ کر نقصان کی نوعیت کے مطابق قابلِ نظر ثانی فیصلہ کرنا چاہیے۔","explanation":""},{"id":"a2","question_id":"q2","answer":"ایک نمایاں واقعہ اور وقت کے ساتھ بار بار آنے والا نمونہ الگ درجے کے شواہد ہیں، اس لیے ان سے یکساں دعویٰ نہیں کرنا چاہیے۔","explanation":""},{"id":"a3","question_id":"q3","answer":"چھوٹی اکائی اور مقامی جگہ سے ملنے والا مشاہدہ مفید ہے مگر اسے پورے موسم یا ضلع کی مکمل نمائندگی نہیں سمجھنا چاہیے۔","explanation":""},{"id":"a4","question_id":"q4","answer":"یہ انسانی ضرورت اور شہری بنیادی ڈھانچے کی کمزوری کو الگ الگ الزام کے بجائے ایک مشترک نظام میں دکھاتا ہے۔","explanation":""},{"id":"a5","question_id":"q5","answer":"مرکب عدد یا محدود حصے کا صحیح نتیجہ اس کے دائرے سے بڑھا کر پورے شہر پر لاگو کیا جاسکتا ہے۔","explanation":""},{"id":"a6","question_id":"q6","answer":"ناقابلِ واپسی نقصان کا امکان مرحلہ وار اور قابلِ نظر ثانی احتیاطی عمل کو معقول بنا سکتا ہے۔","explanation":""},{"id":"a7","question_id":"q7","answer":"واقعہ بمقابلہ کئی سال، مقامی زمین بمقابلہ ضلع، فرد و محلہ بمقابلہ شہر، حصہ بمقابلہ کل، اور موجودہ قدم بمقابلہ طویل مدتی نقصان۔","explanation":""},{"id":"a8","question_id":"q8","answer":"اس سے پتا چلتا ہے کہ کہاں فوری کم خطرہ قدم مناسب ہے، کہاں مزید پیمائش چاہیے، اور کون سا دعویٰ حد سے زیادہ مضبوط ہوگا۔","explanation":""},{"id":"a9","question_id":"q9","answer":"قطعی یقین شواہد کی حدود چھپا سکتا ہے، جبکہ جمود ناقابلِ واپسی نقصان یا فوری خطرے کو بڑھا سکتا ہے۔","explanation":""},{"id":"a10","question_id":"q10","answer":"واقعے اور رجحان میں فرق، مقامی اور وسیع شواہد کا درست ربط، پیمائش کے دائرے کی حفاظت، اور بڑے نقصان میں قابلِ نظر ثانی مرحلہ وار عمل۔","explanation":""}],"speed_training":{"timed":true,"benchmark_eligible":true,"comprehension_gate":0.8,"new_word_policy":"none","notes":"B2 checkpoint"},"quality":{"status":"draft","linguistic_review":"pending","pedagogical_review":"pending","coverage_check":"pending","answer_key_check":"pending","schema_check":"pending","fact_check":"not_required","notes":[]}}
