{"id":"ur-b2-u06-p06","language":"ur","cefr":"B2","unit":6,"sequence":36,"revision":1,"title":"ڈیجیٹل رازداری: معلومات کے سفر کا مشترک جائزہ","passage_type":"checkpoint","genre":"paired opinions","domains":["personal","public","educational","professional"],"topics":["digital life and privacy","privacy synthesis","digital decisions"],"text":"اس یونٹ کی مثالوں نے ڈیجیٹل رازداری کو ایک ہی بٹن یا ایک ہی اجازت کے مسئلے کے بجائے معلومات کے پورے سفر کے طور پر پیش کیا۔ گھر کے آلے کی مثال میں مختصر ریکارڈنگ بننے اور اسے دور کے نظام کو بھیجنا دو الگ مرحلے تھے۔ اگر صارف کو صرف یہ بتایا جائے کہ آلہ “آواز استعمال کرتا ہے” تو وہ یہ نہیں جان سکتا کہ ریکارڈنگ کہاں رکتی ہے، کتنی دیر رہتی ہے اور کب معلومات بھیجنا واقعی ضروری ہے۔\n\nپالیسی کی مثال نے زبان کی اہمیت دکھائی۔ مبہم مقصد رسمی اجازت کو کم معنی خیز بنا سکتا ہے، جبکہ ہر چھوٹی کارروائی کے لیے الگ سوال صارف کو تھکا سکتا ہے۔ اسی لیے مفاہمت کا بہتر مطلب حقوق کم کرنا نہیں بلکہ واضح گروہ بندی، محدود مقصد اور معنی خیز اختیار بنانا تھا۔ صارف کو اتنی معلومات ملنی چاہئیں کہ وہ فیصلہ سمجھ سکے، مگر ساخت اتنی پیچیدہ نہ ہو کہ وہ ہر بار بغیر پڑھے قبول کر دے۔\n\nاکاؤنٹ کے واقعے نے ایک اور فرق واضح کیا۔ معطلی کسی مخصوص اکاؤنٹ پر حفاظتی یا انتظامی روک ہوسکتی ہے، جبکہ تعطل پوری مشترک خدمت کو متاثر کر سکتا ہے۔ دونوں میں داخلہ رک سکتا ہے، لیکن درست اگلا قدم مختلف ہے۔ رازداری اور حفاظت کی اچھی اطلاع اتنی وضاحت دیتی ہے کہ صارف صحیح عمل کرے، مگر اتنی اندرونی تفصیل نہیں کھولتی کہ حفاظتی نظام کمزور ہو جائے۔\n\nذاتی تجاویز کی بحث میں ڈیجیٹل چھاپ اور معلومات کی پرت سامنے آئی۔ الگ الگ چھوٹے اشارے کم حساس لگ سکتے ہیں، مگر ان کی جمع ہوتی چھاپ نئی عادات اور تعلقات ظاہر کر سکتی ہے۔ پرت دار رسائی اس خطرے کو کم کر سکتی ہے اگر ہر پرت کی حقیقی حد ہو اور معلومات آسانی سے دوبارہ نہ جوڑی جا سکیں۔\n\nآلات کی پالیسی نے وقت اور جسمانی نقصان کا پہلو شامل کیا۔ فرسودہ سافٹ ویئر بظاہر چلتا رہ سکتا ہے مگر حفاظتی معاونت ختم ہونے کے بعد خطرہ بڑھ سکتا ہے۔ اسی طرح گمشدہ فون کا خطرہ صرف اس بات پر منحصر نہیں کہ آلہ واپس ملتا ہے یا نہیں؛ قفل، مقامی ذخیرہ، اطلاع کی نمائش اور دور سے انتظام بھی فیصلہ بدلتے ہیں۔\n\nان مثالوں کو جوڑیں تو ذمہ دار ڈیجیٹل نظام کے پانچ اصول بنتے ہیں۔ معلومات کے ہر مرحلے کو الگ نام دیں۔ مبہم مقصد کے بجائے واضح اختیار دیں اور جہاں ضرورت ہو مفاہمت کو قابلِ فہم بنائیں۔ معطلی اور تعطل جیسے مختلف واقعات کو الگ پیغام دیں۔ ڈیجیٹل چھاپ کو پرت دار اور محدود رسائی کے ساتھ سنبھالیں۔ اور فرسودہ یا گمشدہ آلے کے لیے خطرے کے مطابق قابلِ عمل حفاظتی راستہ رکھیں۔ رازداری تب مضبوط ہوتی ہے جب صارف صرف “ہاں” یا “نہیں” نہ کہے بلکہ معلومات کے بہاؤ اور اس کے نتائج کو سمجھ سکے۔","word_count":456,"sentence_count":24,"estimated_known_token_coverage":0,"new_lexical_targets":[],"review_lexical_targets":[{"id":"ur-rank-2424","form":"ریکارڈنگ","review_stage":"R1","representation":"running_text"},{"id":"ur-rank-2431","form":"بھیجنا","review_stage":"R1","representation":"running_text"},{"id":"ur-rank-2503","form":"مبہم","review_stage":"R1","representation":"running_text"},{"id":"ur-rank-2445","form":"مفاہمت","review_stage":"R1","representation":"running_text"},{"id":"ur-rank-2444","form":"معطلی","review_stage":"R1","representation":"running_text"},{"id":"ur-rank-2495","form":"تعطل","review_stage":"R1","representation":"running_text"},{"id":"ur-rank-2464","form":"چھاپ","review_stage":"R1","representation":"running_text"},{"id":"ur-rank-2488","form":"پرت","review_stage":"R1","representation":"running_text"},{"id":"ur-rank-2486","form":"فرسودہ","review_stage":"R1","representation":"running_text"},{"id":"ur-rank-2475","form":"گمشدہ","review_stage":"R1","representation":"running_text"}],"grammar_targets":[{"id":"ur-b2-u06-grammar-06","role":"integration","description":"use qualification, condition, scope, and contrast to explain privacy and security tradeoffs"}],"discourse_targets":[{"id":"ur-b2-u06-discourse-06","role":"integration","description":"connect data flow, user control, system constraints, risk, and policy consequences"}],"questions":[{"id":"q1","type":"main_claim","prompt":"پورے یونٹ کا مشترک رازداری اصول کیا ہے؟","answer_id":"a1"},{"id":"q2","type":"synthesis","prompt":"ریکارڈنگ اور معلومات بھیجنے کی مثال ڈیٹا کے سفر کے بارے میں کیا سکھاتی ہے؟","answer_id":"a2","target_ids":["ur-rank-2424","ur-rank-2431"]},{"id":"q3","type":"synthesis","prompt":"مبہم زبان اور مفاہمت کا تعلق معنی خیز اختیار سے کیسے بنتا ہے؟","answer_id":"a3","target_ids":["ur-rank-2503","ur-rank-2445"]},{"id":"q4","type":"synthesis","prompt":"معطلی اور تعطل کو الگ کرنا کیوں ضروری ہے؟","answer_id":"a4","target_ids":["ur-rank-2444","ur-rank-2495"]},{"id":"q5","type":"synthesis","prompt":"ڈیجیٹل چھاپ اور پرت دار رسائی کے درمیان کیا تعلق ہے؟","answer_id":"a5","target_ids":["ur-rank-2464","ur-rank-2488"]},{"id":"q6","type":"synthesis","prompt":"فرسودہ سافٹ ویئر اور گمشدہ آلہ خطرے کی مختلف شکلیں کیسے دکھاتے ہیں؟","answer_id":"a6","target_ids":["ur-rank-2486","ur-rank-2475"]},{"id":"q7","type":"cross_text_synthesis","prompt":"پانچوں مثالوں میں واضح حد یا دائرہ کس کس شکل میں سامنے آیا؟","answer_id":"a7"},{"id":"q8","type":"inference","prompt":"رازداری کے فیصلے میں صرف ایک اجازت بٹن ناکافی کیوں ہوسکتا ہے؟","answer_id":"a8"},{"id":"q9","type":"stance","prompt":"یونٹ سہولت اور رازداری کو لازماً مکمل مخالف کیوں نہیں سمجھتا؟","answer_id":"a9"},{"id":"q10","type":"summary","prompt":"ذمہ دار ڈیجیٹل نظام کے پانچ عملی اصول مختصراً بیان کریں۔","answer_id":"a10"}],"answer_key":[{"id":"a1","question_id":"q1","answer":"معلومات کے ہر مرحلے، مقصد، رسائی اور خطرے کو واضح کرکے صارف کو قابلِ فہم اور قابلِ عمل اختیار دینا چاہیے۔","explanation":""},{"id":"a2","question_id":"q2","answer":"آواز محفوظ کرنا اور اسے دوسرے نظام تک منتقل کرنا الگ فیصلے ہیں، اس لیے دونوں کی ضرورت، مدت اور دائرہ الگ واضح ہونا چاہیے۔","explanation":""},{"id":"a3","question_id":"q3","answer":"مبہم مقصد رضامندی کو کمزور کرتا ہے، جبکہ مفاہمت تب مفید ہے جب ضروری اور اختیاری استعمال واضح اور قابلِ انتخاب ہوں۔","explanation":""},{"id":"a4","question_id":"q4","answer":"کیونکہ ایک مخصوص اکاؤنٹ کی روک اور عمومی خدمت کی خرابی کے اسباب اور درست اگلے قدم مختلف ہوتے ہیں۔","explanation":""},{"id":"a5","question_id":"q5","answer":"جمع ہوتی چھاپ حساس تصویر بنا سکتی ہے، اس لیے ہر پرت میں معلومات اور رسائی کی حقیقی حد خطرہ کم کرنے میں مدد دیتی ہے۔","explanation":""},{"id":"a6","question_id":"q6","answer":"فرسودہ سافٹ ویئر وقت کے ساتھ حفاظتی معاونت کی کمی کا خطرہ دکھاتا ہے، جبکہ گمشدہ آلہ جسمانی قبضہ کھونے اور ذخیرہ شدہ معلومات کے خطرے کو۔","explanation":""},{"id":"a7","question_id":"q7","answer":"ڈیٹا کے سفر، پالیسی کے مقصد، اکاؤنٹ پیغام، رسائی کی پرت اور ادارہ جاتی آلہ کنٹرول میں حد واضح کرنا بار بار ضروری رہا۔","explanation":""},{"id":"a8","question_id":"q8","answer":"کیونکہ صارف کو یہ بھی جاننا ہوتا ہے کہ کون سی معلومات، کس مقصد، کتنی مدت، کس رسائی اور کس نتیجے کے ساتھ استعمال ہوں گی۔","explanation":""},{"id":"a9","question_id":"q9","answer":"محدود ڈیٹا، پرت دار رسائی، مقامی عمل اور مرحلہ وار حفاظت جیسے ڈیزائن سہولت برقرار رکھتے ہوئے غیر ضروری خطرہ کم کر سکتے ہیں۔","explanation":""},{"id":"a10","question_id":"q10","answer":"ڈیٹا کے مراحل الگ کریں، مقصد و اختیار واضح کریں، مختلف واقعات کے لیے درست پیغام دیں، رسائی کو محدود پرتوں میں رکھیں، اور آلے و سافٹ ویئر کے خطرے کے مطابق قابلِ عمل حفاظت رکھیں۔","explanation":""}],"speed_training":{"timed":true,"benchmark_eligible":true,"comprehension_gate":0.8,"new_word_policy":"none","notes":"checkpoint: accuracy before speed"},"quality":{"status":"draft","linguistic_review":"pending","pedagogical_review":"pending","coverage_check":"pending","answer_key_check":"pending","schema_check":"pending","fact_check":"not_required","notes":[]}}
